<?xml version="1.0" encoding="UTF-8"?>
<strings xmlns="http://www.agileapes.com/pongo/strings"
         xmlns:xsi="http://www.w3.org/2001/XMLSchema-instance"
         xsi:schemaLocation="http://www.agileapes.com/pongo/strings ../../schema/strings.xsd"
         language="fa" country="IR"
         context="jalali">

    <string>
        <value>Shanbeh</value>
        <translation>شنبه</translation>
    </string>
    <string>
        <value>Yekshanbeh</value>
        <translation>یک‌شنبه</translation>
    </string>
    <string>
        <value>Doshanbeh</value>
        <translation>دوشنبه</translation>
    </string>
    <string>
        <value>Seshanbeh</value>
        <translation>سه‌شنبه</translation>
    </string>
    <string>
        <value>Chaharshanbeh</value>
        <translation>چهارشنبه</translation>
    </string>
    <string>
        <value>Panjshanbeh</value>
        <translation>پنج‌شنبه</translation>
    </string>
    <string>
        <value>Jom'eh</value>
        <translation>جمعه</translation>
    </string>
    <string>
        <value>Farvardin</value>
        <translation>فروردین</translation>
    </string>
    <string>
        <value>Ordibehesht</value>
        <translation>اردی‌بهشت</translation>
    </string>
    <string>
        <value>Khordad</value>
        <translation>خرداد</translation>
    </string>
    <string>
        <value>Tir</value>
        <translation>تیر</translation>
    </string>
    <string>
        <value>Mordad</value>
        <translation>مرداد</translation>
    </string>
    <string>
        <value>Shahrivar</value>
        <translation>شهریور</translation>
    </string>
    <string>
        <value>Mehr</value>
        <translation>مهر</translation>
    </string>
    <string>
        <value>Aban</value>
        <translation>آبان</translation>
    </string>
    <string>
        <value>Azar</value>
        <translation>آذر</translation>
    </string>
    <string>
        <value>Dey</value>
        <translation>دی</translation>
    </string>
    <string>
        <value>Bahman</value>
        <translation>بهمن</translation>
    </string>
    <string>
        <value>Esfand</value>
        <translation>اسفند</translation>
    </string>
    <string>
        <value>st</value>
        <translation>ام</translation>
    </string>
    <string>
        <value>nd</value>
        <translation>ام</translation>
    </string>
    <string>
        <value>rd</value>
        <translation>ام</translation>
    </string>
    <string>
        <value>th</value>
        <translation>ام</translation>
    </string>
    <string>
        <value>IRST</value>
        <translation>زمان رسمی ایران</translation>
    </string>
    <string>
        <value>Rial</value>
        <translation>ریال</translation>
    </string>
    <string>
        <value>Rials</value>
        <translation>ریال</translation>
    </string>
    <string>
        <value>IRR</value>
        <translation>ریال</translation>
    </string>
</strings>